<?xml version="1.0" encoding="UTF-8"?>
<dmodule xmlns:xsi="http://www.w3.org/2001/XMLSchema-instance"
         xsi:noNamespaceSchemaLocation="../../schemas/descript.xsd">
  <identAndStatusSection>
    <dmAddress>
      <dmIdent>
        <dmCode modelIdentCode="BWQ1" systemDiffCode="A"
                systemCode="57" subSystemCode="30" subSubSystemCode="10"
                assyCode="00" disassyCode="00" disassyCodeVariant="A"
                infoCode="500" infoCodeVariant="A" itemLocationCode="D"/>
        <language languageIsoCode="en" countryIsoCode="US"/>
        <issueInfo issueNumber="001" inWork="01"/>
      </dmIdent>
      <dmAddressItems>
        <issueDate year="2025" month="09" day="22"/>
        <dmTitle><techName>BWB-Q100</techName><infoName>57-30-10 Removal — Aileron/hinges/actuator (IC 5xx)</infoName></dmTitle>
      </dmAddressItems>
    </dmAddress>
    <dmStatus issueType="new">
      <security securityClassification="01"/>
      <dataRestrictions>
        <restrictionInfo>
          <classificationString>INTERNAL–EVIDENCE-REQUIRED</classificationString>
        </restrictionInfo>
      </dataRestrictions>
      <responsiblePartnerCompany>
        <enterpriseName>AMPEL360</enterpriseName>
      </responsiblePartnerCompany>
    </dmStatus>
  </identAndStatusSection>

  <content>
    <description>
      <levelledPara>
        <title>57-30-10 Removal — Aileron/hinges/actuator (IC 5xx)</title>
        <para>TODO: Add content for 57-30-10 Removal — Aileron/hinges/actuator (IC 5xx)</para>
      </levelledPara>
    </description>
  </content>
</dmodule>