<?xml version="1.0" encoding="UTF-8"?>
<!-- UTCS canonical_hash: pending | MAL-EEM -->
<dmodule xmlns:xsi="http://www.w3.org/2001/XMLSchema-instance"
         xmlns="http://www.s1000d.org/S1000D_6-0/descript"
         xsi:schemaLocation="http://www.s1000d.org/S1000D_6-0/descript descript.xsd">
  <identAndStatusSection>
    <dmAddress>
      <dmIdent>
        <dmCode modelIdentCode="PLS1" systemDiffCode="A" systemCode="20" subSystemCode="20"
                subSubSystemCode="00" assyCode="00" disassyCode="00" disassyCodeVariant="A"
                infoCode="040" infoCodeVariant="A" itemLocationCode="D"/>
      </dmIdent>
      <language countryIsoCode="US">en</language>
    </dmAddress>
    <issueInfo issueNumber="001" inWork="01"/>
    <security securityClassification="01"/>
  </identAndStatusSection>

  <content>
    <levelledPara id="sec.overview">
      <title>Scope</title>
      <para>This data module defines standard practices for sealants and adhesives application on AMPEL360 PLUS airframe components.</para>
    </levelledPara>

    <levelledPara id="sec.materials">
      <title>Approved Materials</title>
      <para>Only certified aerospace-grade sealants and adhesives shall be used, with temperature ratings appropriate for space tourism operations.</para>
    </levelledPara>

    <levelledPara id="sec.application">
      <title>Application Procedures</title>
      <para>Surface preparation, environmental conditions, and cure times must be strictly followed per manufacturer specifications and this standard.</para>
    </levelledPara>

    <levelledPara id="sec.crossref">
      <title>Cross-References</title>
      <para>For pressure vessel sealing, see ATA-21. For fuel system sealing, see ATA-28. For environmental control sealing, see ATA-21.</para>
    </levelledPara>
  </content>
</dmodule>