<?xml version="1.0" encoding="UTF-8"?>
<dmodule xmlns:xsi="http://www.w3.org/2001/XMLSchema-instance"
         xsi:noNamespaceSchemaLocation="../../schemas/descript.xsd">
  <identAndStatusSection>
    <dmAddress>
      <dmIdent>
        <dmCode modelIdentCode="BWQ1" systemDiffCode="A"
                systemCode="57" subSystemCode="10" subSubSystemCode="00"
                assyCode="00" disassyCode="00A" disassyCodeVariant="A"
                infoCode="040" infoCodeVariant="A" itemLocationCode="D"/>
        <language languageIsoCode="en" countryIsoCode="US"/>
        <issueInfo issueNumber="001" inWork="00"/>
      </dmIdent>
      <dmAddressItems>
        <issueDate year="2025" month="09" day="22"/>
        <dmTitle>
          <techName>Wing Structure</techName>
          <infoName>General Description</infoName>
        </dmTitle>
      </dmAddressItems>
    </dmAddress>

    <dmStatus issueType="new">
      <security securityClassification="01"/>
      <dataRestrictions>
        <restrictionInfo>
          <restrictionInstructions>INTERNAL–EVIDENCE-REQUIRED</restrictionInstructions>
        </restrictionInfo>
      </dataRestrictions>
      <responsiblePartnerCompany><enterpriseName>ASI-T2 Architecture Team</enterpriseName></responsiblePartnerCompany>
      <originator><enterpriseName>AMPEL360 BWB-Q100 Program</enterpriseName></originator>

      <applic>
        <displayText>
          <simplePara>BWB-Q100 Baseline (conf_000_baseline), MSN 0001–9999.</simplePara>
        </displayText>
      </applic>

      <brexDmRef>
        <dmRef>
          <dmRefIdent>
            <dmCode modelIdentCode="BWQ1" systemDiffCode="A"
                    systemCode="00" subSystemCode="00" subSubSystemCode="00"
                    assyCode="00" disassyCode="00A" disassyCodeVariant="A"
                    infoCode="022" infoCodeVariant="A" itemLocationCode="D"/>
          </dmRefIdent>
        </dmRef>
      </brexDmRef>

      <qualityAssurance><unverified/></qualityAssurance>
    </dmStatus>
  </identAndStatusSection>
  
  <content>
    <description>
      <levelledPara>
        <title>General</title>
        <para>The BWB-Q100 wing integrates with the center body to form a continuous lifting surface with integral tanks and distributed interfaces to control and high-lift systems.</para>
      </levelledPara>
      <levelledPara>
        <title>Wing box primary structure</title>
        <randomList>
          <listItem><para>Primary load paths for flight and ground loads.</para></listItem>
          <listItem><para>Integral fuel containment and baffle interfaces.</para></listItem>
          <listItem><para>Attachment hard-points for control surfaces and equipment.</para></listItem>
          <listItem><para>Blended center-body integration frames and chords.</para></listItem>
        </randomList>
      </levelledPara>
    </description>
  </content>
</dmodule>