<?xml version="1.0" encoding="UTF-8"?>
<dmodule xmlns:xsi="http://www.w3.org/2001/XMLSchema-instance"
         xsi:noNamespaceSchemaLocation="../../schemas/descript.xsd">
  <identAndStatusSection>
    <dmAddress>
      <dmIdent>
        <dmCode modelIdentCode="BWQ1" systemDiffCode="A"
                systemCode="57" subSystemCode="10" subSubSystemCode="00"
                assyCode="00" disassyCode="00" disassyCodeVariant="A"
                infoCode="040" infoCodeVariant="A" itemLocationCode="D"/>
        <language languageIsoCode="en" countryIsoCode="US"/>
        <issueInfo issueNumber="001" inWork="01"/>
      </dmIdent>
      <dmAddressItems>
        <issueDate year="2025" month="09" day="23"/>
        <dmTitle>
          <techName>BWB-Q100</techName>
          <infoName>Auto-generated draft (IC 040)</infoName>
        </dmTitle>
      </dmAddressItems>
    </dmAddress>
    <dmStatus issueType="new">
      <security securityClassification="01"/>
      <dataRestrictions><restrictionInfo>
        <classificationString>INTERNALâ€“EVIDENCE-REQUIRED</classificationString>
      </restrictionInfo></dataRestrictions>
      <brexDmRef>
        <dmRef><dmRefIdent>
          <dmCode modelIdentCode="BWQ1" systemDiffCode="A"
                  systemCode="00" subSystemCode="00" subSubSystemCode="00"
                  assyCode="00" disassyCode="00A" disassyCodeVariant="A"
                  infoCode="022" infoCodeVariant="A" itemLocationCode="D"/>
        </dmRefIdent></dmRef>
      </brexDmRef>
      <responsiblePartnerCompany><enterpriseName>AMPEL360</enterpriseName></responsiblePartnerCompany>
    </dmStatus>
  </identAndStatusSection>
  <content>
<description>
  <levelledPara>
    <title>General Description</title>
    <para>This data module provides a general description of the BWB-Q100 wing structure system.</para>
  </levelledPara>
  <levelledPara>
    <title>System Overview</title>
    <para>The wing structure system consists of the primary structural elements that form the wing assembly, including:</para>
    <randomList>
      <listItem><para>Primary wing spars and frames</para></listItem>
      <listItem><para>Wing skin panels and stiffeners</para></listItem>
      <listItem><para>Wing-to-fuselage attachment points</para></listItem>
    </randomList>
  </levelledPara>
  <levelledPara>
    <title>Functional Requirements</title>
    <para>The wing structure provides structural integrity and load transfer capability for the aircraft during all phases of flight operation.</para>
  </levelledPara>
</description>
</content>
</dmodule>