<?xml version="1.0" encoding="UTF-8"?>
<dmodule xmlns:xsi="http://www.w3.org/2001/XMLSchema-instance"
         xsi:noNamespaceSchemaLocation="../../schemas/descript.xsd">
  <identAndStatusSection>
    <dmAddress>
      <dmIdent>
        <dmCode modelIdentCode="BWQ1" systemDiffCode="A"
                systemCode="27" subSystemCode="50" subSubSystemCode="00"
                assyCode="00" disassyCode="00" disassyCodeVariant="A"
                infoCode="040" infoCodeVariant="A" itemLocationCode="D"/>
        <language languageIsoCode="en" countryIsoCode="US"/>
        <issueInfo issueNumber="001" inWork="01"/>
      </dmIdent>
      <dmAddressItems>
        <issueDate year="2025" month="09" day="22"/>
        <dmTitle><techName>BWB-Q100</techName><infoName>ATA-27 Wing actuation interfaces (external reference from 57)</infoName></dmTitle>
      </dmAddressItems>
    </dmAddress>
    <dmStatus issueType="new">
      <security securityClassification="01"/>
      <dataRestrictions>
        <restrictionInfo>
          <classificationString>INTERNALâ€“EVIDENCE-REQUIRED</classificationString>
        </restrictionInfo>
      </dataRestrictions>
      <responsiblePartnerCompany>
        <enterpriseName>AMPEL360</enterpriseName>
      </responsiblePartnerCompany>
    </dmStatus>
  </identAndStatusSection>

  <content>
    <description>
      <levelledPara>
        <title>ATA-27 Wing actuation interfaces (external reference from 57)</title>
        <para>TODO: Add content for ATA-27 Wing actuation interfaces (external reference from 57)</para>
      </levelledPara>
    </description>
  </content>
</dmodule>